{
  "$schema": "https://json-schema.org/draft/2020-12/schema",
  "title": "Normalized Vocabulary Snapshot",
  "type": "object",
  "required": [
    "name",
    "version",
    "source",
    "source_sha256",
    "license",
    "entries"
  ],
  "additionalProperties": false,
  "properties": {
    "name": { "type": "string", "minLength": 1 },
    "version": { "type": "string", "minLength": 1 },
    "source": { "type": "string", "format": "uri" },
    "source_sha256": { "type": "string", "pattern": "^[0-9a-f]{64}$" },
    "license": { "type": "string", "minLength": 1 },
    "entries": {
      "type": "array",
      "minItems": 1,
      "items": {
        "type": "object",
        "required": ["code", "scopes"],
        "additionalProperties": false,
        "properties": {
          "code": { "type": "string", "minLength": 1 },
          "scopes": {
            "type": "array",
            "minItems": 1,
            "uniqueItems": true,
            "items": {
              "enum": [
                "prefix",
                "unit",
                "all",
                "time",
                "gestation",
                "dose",
                "frequency",
                "dose_form",
                "route"
              ]
            }
          }
        }
      }
    }
  }
}
