{
  "entries": [
    {
      "code": "%",
      "scopes": [
        "unit"
      ]
    },
    {
      "code": "%[slope]",
      "scopes": [
        "unit"
      ]
    },
    {
      "code": "'",
      "scopes": [
        "unit"
      ]
    },
    {
      "code": "''",
      "scopes": [
        "unit"
      ]
    },
    {
      "code": "10*",
      "scopes": [
        "unit"
      ]
    },
    {
      "code": "10^",
      "scopes": [
        "unit"
      ]
    },
    {
      "code": "A",
      "scopes": [
        "unit"
      ]
    },
    {
      "code": "AU",
      "scopes": [
        "unit"
      ]
    },
    {
      "code": "Ao",
      "scopes": [
        "unit"
      ]
    },
    {
      "code": "B",
      "scopes": [
        "unit"
      ]
    },
    {
      "code": "B[10.nV]",
      "scopes": [
        "unit"
      ]
    },
    {
      "code": "B[SPL]",
      "scopes": [
        "unit"
      ]
    },
    {
      "code": "B[V]",
      "scopes": [
        "unit"
      ]
    },
    {
      "code": "B[W]",
      "scopes": [
        "unit"
      ]
    },
    {
      "code": "B[kW]",
      "scopes": [
        "unit"
      ]
    },
    {
      "code": "B[mV]",
      "scopes": [
        "unit"
      ]
    },
    {
      "code": "B[uV]",
      "scopes": [
        "unit"
      ]
    },
    {
      "code": "Bd",
      "scopes": [
        "unit"
      ]
    },
    {
      "code": "Bi",
      "scopes": [
        "unit"
      ]
    },
    {
      "code": "Bq",
      "scopes": [
        "unit"
      ]
    },
    {
      "code": "By",
      "scopes": [
        "unit"
      ]
    },
    {
      "code": "C",
      "scopes": [
        "unit"
      ]
    },
    {
      "code": "Cel",
      "scopes": [
        "unit"
      ]
    },
    {
      "code": "Ci",
      "scopes": [
        "unit"
      ]
    },
    {
      "code": "E",
      "scopes": [
        "prefix"
      ]
    },
    {
      "code": "F",
      "scopes": [
        "unit"
      ]
    },
    {
      "code": "G",
      "scopes": [
        "prefix",
        "unit"
      ]
    },
    {
      "code": "Gal",
      "scopes": [
        "unit"
      ]
    },
    {
      "code": "Gb",
      "scopes": [
        "unit"
      ]
    },
    {
      "code": "Gi",
      "scopes": [
        "prefix"
      ]
    },
    {
      "code": "Gy",
      "scopes": [
        "unit"
      ]
    },
    {
      "code": "H",
      "scopes": [
        "unit"
      ]
    },
    {
      "code": "Hz",
      "scopes": [
        "unit"
      ]
    },
    {
      "code": "J",
      "scopes": [
        "unit"
      ]
    },
    {
      "code": "K",
      "scopes": [
        "unit"
      ]
    },
    {
      "code": "Ki",
      "scopes": [
        "prefix"
      ]
    },
    {
      "code": "Ky",
      "scopes": [
        "unit"
      ]
    },
    {
      "code": "L",
      "scopes": [
        "unit"
      ]
    },
    {
      "code": "Lmb",
      "scopes": [
        "unit"
      ]
    },
    {
      "code": "M",
      "scopes": [
        "prefix"
      ]
    },
    {
      "code": "Mi",
      "scopes": [
        "prefix"
      ]
    },
    {
      "code": "Mx",
      "scopes": [
        "unit"
      ]
    },
    {
      "code": "N",
      "scopes": [
        "unit"
      ]
    },
    {
      "code": "Np",
      "scopes": [
        "unit"
      ]
    },
    {
      "code": "Oe",
      "scopes": [
        "unit"
      ]
    },
    {
      "code": "Ohm",
      "scopes": [
        "unit"
      ]
    },
    {
      "code": "P",
      "scopes": [
        "prefix",
        "unit"
      ]
    },
    {
      "code": "Pa",
      "scopes": [
        "unit"
      ]
    },
    {
      "code": "R",
      "scopes": [
        "unit"
      ]
    },
    {
      "code": "RAD",
      "scopes": [
        "unit"
      ]
    },
    {
      "code": "REM",
      "scopes": [
        "unit"
      ]
    },
    {
      "code": "S",
      "scopes": [
        "unit"
      ]
    },
    {
      "code": "St",
      "scopes": [
        "unit"
      ]
    },
    {
      "code": "Sv",
      "scopes": [
        "unit"
      ]
    },
    {
      "code": "T",
      "scopes": [
        "prefix",
        "unit"
      ]
    },
    {
      "code": "Ti",
      "scopes": [
        "prefix"
      ]
    },
    {
      "code": "U",
      "scopes": [
        "unit"
      ]
    },
    {
      "code": "V",
      "scopes": [
        "unit"
      ]
    },
    {
      "code": "W",
      "scopes": [
        "unit"
      ]
    },
    {
      "code": "Wb",
      "scopes": [
        "unit"
      ]
    },
    {
      "code": "Y",
      "scopes": [
        "prefix"
      ]
    },
    {
      "code": "Z",
      "scopes": [
        "prefix"
      ]
    },
    {
      "code": "[APL'U]",
      "scopes": [
        "unit"
      ]
    },
    {
      "code": "[AU]",
      "scopes": [
        "unit"
      ]
    },
    {
      "code": "[Amb'a'1'U]",
      "scopes": [
        "unit"
      ]
    },
    {
      "code": "[BAU]",
      "scopes": [
        "unit"
      ]
    },
    {
      "code": "[Btu]",
      "scopes": [
        "unit"
      ]
    },
    {
      "code": "[Btu_39]",
      "scopes": [
        "unit"
      ]
    },
    {
      "code": "[Btu_59]",
      "scopes": [
        "unit"
      ]
    },
    {
      "code": "[Btu_60]",
      "scopes": [
        "unit"
      ]
    },
    {
      "code": "[Btu_IT]",
      "scopes": [
        "unit"
      ]
    },
    {
      "code": "[Btu_m]",
      "scopes": [
        "unit"
      ]
    },
    {
      "code": "[Btu_th]",
      "scopes": [
        "unit"
      ]
    },
    {
      "code": "[CCID_50]",
      "scopes": [
        "unit"
      ]
    },
    {
      "code": "[CFU]",
      "scopes": [
        "unit"
      ]
    },
    {
      "code": "[Cal]",
      "scopes": [
        "unit"
      ]
    },
    {
      "code": "[Ch]",
      "scopes": [
        "unit"
      ]
    },
    {
      "code": "[D'ag'U]",
      "scopes": [
        "unit"
      ]
    },
    {
      "code": "[EID_50]",
      "scopes": [
        "unit"
      ]
    },
    {
      "code": "[ELU]",
      "scopes": [
        "unit"
      ]
    },
    {
      "code": "[EU]",
      "scopes": [
        "unit"
      ]
    },
    {
      "code": "[FEU]",
      "scopes": [
        "unit"
      ]
    },
    {
      "code": "[FFU]",
      "scopes": [
        "unit"
      ]
    },
    {
      "code": "[FNU]",
      "scopes": [
        "unit"
      ]
    },
    {
      "code": "[GPL'U]",
      "scopes": [
        "unit"
      ]
    },
    {
      "code": "[G]",
      "scopes": [
        "unit"
      ]
    },
    {
      "code": "[HPF]",
      "scopes": [
        "unit"
      ]
    },
    {
      "code": "[HP]",
      "scopes": [
        "unit"
      ]
    },
    {
      "code": "[IR]",
      "scopes": [
        "unit"
      ]
    },
    {
      "code": "[IU]",
      "scopes": [
        "unit"
      ]
    },
    {
      "code": "[LPF]",
      "scopes": [
        "unit"
      ]
    },
    {
      "code": "[Lf]",
      "scopes": [
        "unit"
      ]
    },
    {
      "code": "[MET]",
      "scopes": [
        "unit"
      ]
    },
    {
      "code": "[MPL'U]",
      "scopes": [
        "unit"
      ]
    },
    {
      "code": "[NTU]",
      "scopes": [
        "unit"
      ]
    },
    {
      "code": "[PFU]",
      "scopes": [
        "unit"
      ]
    },
    {
      "code": "[PNU]",
      "scopes": [
        "unit"
      ]
    },
    {
      "code": "[PRU]",
      "scopes": [
        "unit"
      ]
    },
    {
      "code": "[S]",
      "scopes": [
        "unit"
      ]
    },
    {
      "code": "[TCID_50]",
      "scopes": [
        "unit"
      ]
    },
    {
      "code": "[USP'U]",
      "scopes": [
        "unit"
      ]
    },
    {
      "code": "[acr_br]",
      "scopes": [
        "unit"
      ]
    },
    {
      "code": "[acr_us]",
      "scopes": [
        "unit"
      ]
    },
    {
      "code": "[anti'Xa'U]",
      "scopes": [
        "unit"
      ]
    },
    {
      "code": "[arb'U]",
      "scopes": [
        "unit"
      ]
    },
    {
      "code": "[bbl_us]",
      "scopes": [
        "unit"
      ]
    },
    {
      "code": "[bdsk'U]",
      "scopes": [
        "unit"
      ]
    },
    {
      "code": "[beth'U]",
      "scopes": [
        "unit"
      ]
    },
    {
      "code": "[bf_i]",
      "scopes": [
        "unit"
      ]
    },
    {
      "code": "[bu_br]",
      "scopes": [
        "unit"
      ]
    },
    {
      "code": "[bu_us]",
      "scopes": [
        "unit"
      ]
    },
    {
      "code": "[c]",
      "scopes": [
        "unit"
      ]
    },
    {
      "code": "[car_Au]",
      "scopes": [
        "unit"
      ]
    },
    {
      "code": "[car_m]",
      "scopes": [
        "unit"
      ]
    },
    {
      "code": "[cft_i]",
      "scopes": [
        "unit"
      ]
    },
    {
      "code": "[ch_br]",
      "scopes": [
        "unit"
      ]
    },
    {
      "code": "[ch_us]",
      "scopes": [
        "unit"
      ]
    },
    {
      "code": "[cicero]",
      "scopes": [
        "unit"
      ]
    },
    {
      "code": "[cin_i]",
      "scopes": [
        "unit"
      ]
    },
    {
      "code": "[cml_i]",
      "scopes": [
        "unit"
      ]
    },
    {
      "code": "[cr_i]",
      "scopes": [
        "unit"
      ]
    },
    {
      "code": "[crd_us]",
      "scopes": [
        "unit"
      ]
    },
    {
      "code": "[cup_m]",
      "scopes": [
        "unit"
      ]
    },
    {
      "code": "[cup_us]",
      "scopes": [
        "unit"
      ]
    },
    {
      "code": "[cyd_i]",
      "scopes": [
        "unit"
      ]
    },
    {
      "code": "[degF]",
      "scopes": [
        "unit"
      ]
    },
    {
      "code": "[degR]",
      "scopes": [
        "unit"
      ]
    },
    {
      "code": "[degRe]",
      "scopes": [
        "unit"
      ]
    },
    {
      "code": "[den]",
      "scopes": [
        "unit"
      ]
    },
    {
      "code": "[didot]",
      "scopes": [